{"$schema":"./nautilus-sandbox-request-v2.schema.json","authority_counters":{"broker_requests":0,"credential_reads":0,"network_requests":0,"orders_outside_fixture":0,"production_state_writes":0},"closed_bars":[{"bar_type":"ETHUSDT-4H-CLOSED","close":"1800","close_time":"2026-01-01T04:00:00.000Z","event_hash":"b1fbe5a3f623af7ada69804794ff65ecaacbb8d8cdd0207687a7b37616330653","high":"1812","low":"1785","open":"1795","open_time":"2026-01-01T00:00:00.000Z","sequence":1,"volume":"1010"},{"bar_type":"ETHUSDT-4H-CLOSED","close":"1810","close_time":"2026-01-01T08:00:00.000Z","event_hash":"5ac9c3f8d194733521212db9ac0df4f79e92a1494e24e0b1b2959de4b6bd2045","high":"1822","low":"1795","open":"1805","open_time":"2026-01-01T04:00:00.000Z","sequence":2,"volume":"1020"},{"bar_type":"ETHUSDT-4H-CLOSED","close":"1825","close_time":"2026-01-01T12:00:00.000Z","event_hash":"abf68ed05a15b66ce4467c650428d57f860c3da6bbfeba74121752e14be7682c","high":"1837","low":"1810","open":"1820","open_time":"2026-01-01T08:00:00.000Z","sequence":3,"volume":"1030"},{"bar_type":"ETHUSDT-4H-CLOSED","close":"1815","close_time":"2026-01-01T16:00:00.000Z","event_hash":"a268f5b4a42529ad24d48f7462c504109b06368b0a2bde908de7f451152d3155","high":"1827","low":"1800","open":"1810","open_time":"2026-01-01T12:00:00.000Z","sequence":4,"volume":"1040"},{"bar_type":"ETHUSDT-4H-CLOSED","close":"1830","close_time":"2026-01-01T20:00:00.000Z","event_hash":"b71637f39d8af3062004d953984ed0e417ad17b4e2686a802ec2b9e6edde6f05","high":"1842","low":"1815","open":"1825","open_time":"2026-01-01T16:00:00.000Z","sequence":5,"volume":"1050"},{"bar_type":"ETHUSDT-4H-CLOSED","close":"1845","close_time":"2026-01-02T00:00:00.000Z","event_hash":"ed2f05682acd3d37ae8499463c95208eb388f43821a6689fad28a2765b9771d1","high":"1857","low":"1830","open":"1840","open_time":"2026-01-01T20:00:00.000Z","sequence":6,"volume":"1060"},{"bar_type":"ETHUSDT-4H-CLOSED","close":"1860","close_time":"2026-01-02T04:00:00.000Z","event_hash":"25e31e7b765f4725f83ea29793f34153241925cb4404e99f3d436ee4d348ac06","high":"1872","low":"1845","open":"1855","open_time":"2026-01-02T00:00:00.000Z","sequence":7,"volume":"1070"},{"bar_type":"ETHUSDT-4H-CLOSED","close":"1850","close_time":"2026-01-02T08:00:00.000Z","event_hash":"3cdce72d196f6610c89023fecbfc02940ac5543aad88e6206e73861cff29ab2d","high":"1862","low":"1835","open":"1845","open_time":"2026-01-02T04:00:00.000Z","sequence":8,"volume":"1080"},{"bar_type":"ETHUSDT-4H-CLOSED","close":"1875","close_time":"2026-01-02T12:00:00.000Z","event_hash":"e3ed26e993df3b64e21271f6f2cc0f27dc12fa8b1b307595e07c2b36ede75934","high":"1887","low":"1860","open":"1870","open_time":"2026-01-02T08:00:00.000Z","sequence":9,"volume":"1090"},{"bar_type":"ETHUSDT-4H-CLOSED","close":"1890","close_time":"2026-01-02T16:00:00.000Z","event_hash":"62c5092b7e494ae07fc344e021d28d08d61e4fceb0a7ded0aaa3720e2d004d13","high":"1902","low":"1875","open":"1885","open_time":"2026-01-02T12:00:00.000Z","sequence":10,"volume":"1100"},{"bar_type":"ETHUSDT-4H-CLOSED","close":"1880","close_time":"2026-01-02T20:00:00.000Z","event_hash":"eb567a542bd085ed6d58b6242a19141adf67edf43250c13ece85ed7286abb6c0","high":"1892","low":"1865","open":"1875","open_time":"2026-01-02T16:00:00.000Z","sequence":11,"volume":"1110"},{"bar_type":"ETHUSDT-4H-CLOSED","close":"1905","close_time":"2026-01-03T00:00:00.000Z","event_hash":"ec9f977ca4fdb63e40d11c3167849e7a73a12aec75aab4db9b6ced1ca5523620","high":"1917","low":"1890","open":"1900","open_time":"2026-01-02T20:00:00.000Z","sequence":12,"volume":"1120"},{"bar_type":"ETHUSDT-4H-CLOSED","close":"1920","close_time":"2026-01-03T04:00:00.000Z","event_hash":"0011a7518719ebdfa241800c0b2afae6382b57fd31101d63274630e9dfefd136","high":"1932","low":"1905","open":"1915","open_time":"2026-01-03T00:00:00.000Z","sequence":13,"volume":"1130"},{"bar_type":"ETHUSDT-4H-CLOSED","close":"1935","close_time":"2026-01-03T08:00:00.000Z","event_hash":"ebeaec3960b323b7748b354373f9c23fa6bcdfc432c70fb6ac153901a3ce1d08","high":"1947","low":"1920","open":"1930","open_time":"2026-01-03T04:00:00.000Z","sequence":14,"volume":"1140"},{"bar_type":"ETHUSDT-4H-CLOSED","close":"1925","close_time":"2026-01-03T12:00:00.000Z","event_hash":"bcab9785dc888ac1f3e646f17e0ff0ca73bfd21bf8d15b018ce212a2c20f0efd","high":"1937","low":"1910","open":"1920","open_time":"2026-01-03T08:00:00.000Z","sequence":15,"volume":"1150"},{"bar_type":"ETHUSDT-4H-CLOSED","close":"1950","close_time":"2026-01-03T16:00:00.000Z","event_hash":"b4231b295253fcf0bd8b5e727d975cabc37e94c6c116399d71b579bcca83c516","high":"1962","low":"1935","open":"1945","open_time":"2026-01-03T12:00:00.000Z","sequence":16,"volume":"1160"},{"bar_type":"ETHUSDT-4H-CLOSED","close":"1965","close_time":"2026-01-03T20:00:00.000Z","event_hash":"0e6ea6bed7cee8a70f84694c72f376a87d4f345802e8e480c39725be25b3676a","high":"1977","low":"1950","open":"1960","open_time":"2026-01-03T16:00:00.000Z","sequence":17,"volume":"1170"},{"bar_type":"ETHUSDT-4H-CLOSED","close":"1980","close_time":"2026-01-04T00:00:00.000Z","event_hash":"dbd46135b6126b2a609a1bf1c82d80e82976b5bb2536ba9beaa498e32872545e","high":"1992","low":"1965","open":"1975","open_time":"2026-01-03T20:00:00.000Z","sequence":18,"volume":"1180"},{"bar_type":"ETHUSDT-4H-CLOSED","close":"1970","close_time":"2026-01-04T04:00:00.000Z","event_hash":"3b09b94f2d4d20d12a8dd65248e5b65d6f894dfe2681997f6e01b3c428cf75eb","high":"1982","low":"1955","open":"1965","open_time":"2026-01-04T00:00:00.000Z","sequence":19,"volume":"1190"},{"bar_type":"ETHUSDT-4H-CLOSED","close":"1990","close_time":"2026-01-04T08:00:00.000Z","event_hash":"c04c0ff844312a21322fc0de511a7c4ac3e703631fe26e0924124804484cb43e","high":"2002","low":"1975","open":"1985","open_time":"2026-01-04T04:00:00.000Z","sequence":20,"volume":"1200"},{"bar_type":"ETHUSDT-4H-CLOSED","close":"2000","close_time":"2026-01-04T12:00:00.000Z","event_hash":"656964d129005202ba863a334088c94fc37c765fa8cd4916a0d4df4ff45f64df","high":"2012","low":"1985","open":"1995","open_time":"2026-01-04T08:00:00.000Z","sequence":21,"volume":"1210"}],"decision_authority":{"decision":{"action":"SET_TARGET","decided_at":"2026-01-04T12:00:00.000Z","decision_id":"decision_c0da50627f946c7da48fd81c5ff1a57c28658056b7b76b20160fa2f118ec2a3f","direction":"LONG","instrument_id":"BINANCE:SPOT:ETHUSDT"},"risk":{"authorized":true,"max_notional_usdt":"101","max_quantity":"0.05","risk_id":"risk_0b83314f6424b650eaaa850f40638bcf2abdd4a6ed03ed7b89438aa8a409f802","short_allowed":false,"target_id":"target_532db677e3b97171b2decdf283ea7f177b7d700810da86241de157d87b3ab18c"},"target":{"decision_id":"decision_c0da50627f946c7da48fd81c5ff1a57c28658056b7b76b20160fa2f118ec2a3f","quantity":"0.05","side":"BUY","target_id":"target_532db677e3b97171b2decdf283ea7f177b7d700810da86241de157d87b3ab18c","target_position_eth":"0.05"}},"fixture_hash":"8f9047ebd6271d2dc9f043aedacb065355cd24e507e29c4a11aa747f1531109c","fixture_id":"ethusdt_4h_v2","instrument":{"base_asset":"ETH","instrument_id":"BINANCE:SPOT:ETHUSDT","maker_fee":"0.001","min_notional":"5","min_quantity":"0.0001","price_precision":2,"price_tick":"0.01","quantity_precision":4,"quantity_step":"0.0001","quote_asset":"USDT","symbol":"ETHUSDT","taker_fee":"0.001"},"plan_hash":"2222222222222222222222222222222222222222222222222222222222222222","plan_id":"nautilus_v065_plan_1111111111111111111111111111111111111111111111111111111111111111","request_hash":"634b7518b5c18c216a06d513335bfd6858b3100354e9d4e9d7a285573f15fd1f","request_id":"nautilus_v065_request_634b7518b5c18c216a06d513335bfd6858b3100354e9d4e9d7a285573f15fd1f","scenarios":[{"events":[{"ask":"2000.1","ask_size":"10","bid":"2000","bid_size":"10","event_hash":"4cac47282f65be8bd71eb0780119a338fc518c8918e746549a1412079a2daf07","kind":"BBO","occurred_at":"2026-01-04T12:00:01.000Z","sequence":1},{"aggressor_side":"BUY","event_hash":"7b5bca9914c57c10bbe5d0cd84e39888918e9bab4b28168933cae3c519267db0","kind":"TRADE","occurred_at":"2026-01-04T12:00:02.000Z","price":"2000.1","quantity":"0.05","sequence":2}],"order_intent":{"decision_id":"decision_c0da50627f946c7da48fd81c5ff1a57c28658056b7b76b20160fa2f118ec2a3f","order_type":"MARKET","quantity":"0.05","risk_id":"risk_0b83314f6424b650eaaa850f40638bcf2abdd4a6ed03ed7b89438aa8a409f802","side":"BUY","target_id":"target_532db677e3b97171b2decdf283ea7f177b7d700810da86241de157d87b3ab18c"},"scenario":"IMMEDIATE_FULL","scenario_hash":"0fda97b3842e7d2f8127e0026b1008e53596c9d5d9b827ea583b3166d1813536"},{"events":[{"ask":"2000.1","ask_size":"0.02","bid":"2000","bid_size":"10","event_hash":"4ae69160b08245f685c29074b37c8f1d5a03ae417a4a47cc8beaf061a04bc941","kind":"BBO","occurred_at":"2026-01-04T12:00:01.000Z","sequence":1},{"aggressor_side":"BUY","event_hash":"233812ffefb897068f00f1aa55457463baf86fb1d622a49f20c17962e51169d6","kind":"TRADE","occurred_at":"2026-01-04T12:00:02.000Z","price":"2000.1","quantity":"0.02","sequence":2},{"ask":"2000.2","ask_size":"10","bid":"2000.15","bid_size":"10","event_hash":"b513936b51ee3ab3c7244f5542b623483b1c0a8cdee89e1c5d60f7334ff9ded3","kind":"BBO","occurred_at":"2026-01-04T12:00:03.000Z","sequence":3},{"aggressor_side":"BUY","event_hash":"21e264968e3ba93e7b34e53ec7572c373b97188f7463ff2fdce2773525d5ea52","kind":"TRADE","occurred_at":"2026-01-04T12:00:04.000Z","price":"2000.2","quantity":"0.03","sequence":4}],"order_intent":{"decision_id":"decision_c0da50627f946c7da48fd81c5ff1a57c28658056b7b76b20160fa2f118ec2a3f","order_type":"MARKET","quantity":"0.05","risk_id":"risk_0b83314f6424b650eaaa850f40638bcf2abdd4a6ed03ed7b89438aa8a409f802","side":"BUY","target_id":"target_532db677e3b97171b2decdf283ea7f177b7d700810da86241de157d87b3ab18c"},"scenario":"PARTIAL_THEN_FULL","scenario_hash":"c8afc2a84fb64d93ae8cf8c7c3f36932b76a228accf7c5b5b8b041022c7abfed"},{"events":[{"ask":"2000.1","ask_size":"10","bid":"2000","bid_size":"10","event_hash":"4cac47282f65be8bd71eb0780119a338fc518c8918e746549a1412079a2daf07","kind":"BBO","occurred_at":"2026-01-04T12:00:01.000Z","sequence":1}],"order_intent":{"decision_id":"decision_c0da5062